<?xml version="1.0" encoding="ISO-8859-1" ?>
<!--
/*
 * Licensed to the Apache Software Foundation (ASF) under one
 * or more contributor license agreements.  See the NOTICE file
 * distributed with this work for additional information
 * regarding copyright ownership.  The ASF licenses this file
 * to you under the Apache License, Version 2.0 (the
 * "License"); you may not use this file except in compliance
 * with the License.  You may obtain a copy of the License at
 *
 * http://www.apache.org/licenses/LICENSE-2.0
 *
 * Unless required by applicable law or agreed to in writing,
 * software distributed under the License is distributed on an
 * "AS IS" BASIS, WITHOUT WARRANTIES OR CONDITIONS OF ANY
 * KIND, either express or implied.  See the License for the
 * specific language governing permissions and limitations
 * under the License.
 *
 */
-->

<!DOCTYPE tiles-definitions PUBLIC
        "-//Apache Software Foundation//DTD Tiles Configuration 3.0//EN"
        "http://tiles.apache.org/dtds/tiles-config_3_0.dtd">

<tiles-definitions>

    <definition name="showcase.index" template="/WEB-INF/tiles/layout.jsp">
        <put-attribute name="title" value="Tiles Showcase"/>
        <put-attribute name="header" value="/WEB-INF/tiles/header.jsp"/>
        <put-attribute name="body" value="/WEB-INF/tiles/body.jsp"/>
    </definition>

    <definition name="showcase.freemarker" template="/WEB-INF/tiles/layout.jsp">
        <put-attribute name="title" value="Tiles/Freemarker Showcase"/>
        <put-attribute name="header" value="/WEB-INF/tiles/header.jsp"/>
        <put-attribute name="body" value="/WEB-INF/tiles/body.ftl"/>
    </definition>

    <definition name="showcase.freemarkerLayout" template="/WEB-INF/tiles/layout.ftl">
        <put-attribute name="title" value="Tiles/Freemarker Showcase"/>
        <put-attribute name="header" value="/WEB-INF/tiles/header.jsp"/>
        <put-attribute name="body" value="/WEB-INF/tiles/body.ftl"/>
    </definition>

    <definition name="showcase.annotations" template="/WEB-INF/tiles/layout-annotations.jsp">
        <put-attribute name="title" value="Tiles Annotations Showcase"/>
        <put-attribute name="header" value=".header"/>
        <put-attribute name="body" value=".body"/>
    </definition>

</tiles-definitions>
